Downloaded on,04/14/2026,19:06:15 EDT,,,
IN12679,The Length of Major Steps in the Supreme Court Appointment Process (1975-2022),https://www.congress.gov/crs-product/IN12679,04/13/2026,"McMillion, Barry J.",
RL30857,"Speakers of the House: Elections, 1913-2025",https://www.congress.gov/crs-product/RL30857,04/13/2026,"Heitshusen, Valerie",Congressional Administration & Elections; Legislative & Budget Process
IF12608,U.S. Interest in Seabed Mining in Areas Beyond National Jurisdiction: Brief Background and Recent Developments,https://www.congress.gov/crs-product/IF12608,04/13/2026,"Keating-Bitonti, Caitlin",Energy & Natural Resources
IN12423,Preliminary Data on the IRA Residential Clean Energy Credit,https://www.congress.gov/crs-product/IN12423,04/13/2026,"Buffie, Nicholas E.","Budget, Public Finance & Taxation; Energy & Natural Resources"
IN12422,Preliminary Data on the IRA Energy Efficient Home Improvement Credit,https://www.congress.gov/crs-product/IN12422,04/13/2026,"Buffie, Nicholas E.","Budget, Public Finance & Taxation; Energy & Natural Resources"
IF12024,Farm Bill Primer: Conservation Title,https://www.congress.gov/crs-product/IF12024,04/13/2026,"Stubbs, Megan","Agriculture, Food & Rural Policy"
98-317,Types of Committee Hearings,https://www.congress.gov/crs-product/98-317,04/13/2026,"Heitshusen, Valerie",Congressional Administration & Elections; Legislative & Budget Process
IF11643,Artemis: NASA’s Program to Return Humans to the Moon,https://www.congress.gov/crs-product/IF11643,04/13/2026,"Lindbergh, Rachel",Commerce & Small Business; Science & Technology
